id,blurb
1103120557,"I am creating a durable, inflatable deck that attaches to kayaks for dogs to stand/rest on when kayaking!"
626438263,A condom dispensing device for your home. Never lose the mood again looking for a condom
930123079,"900"" giant screen l Monocular 60hz refresh rate l 3184PPI l Distortion <3% l Make the traditional games have VR experience."
1535719010,The wireless Magnetic fast-charging phone mount for your car’s dashboard with Intelligent Lifting Sensor
1742404620,"On Halloween night, Charlie & Clow protect their city from a roaming Wendigo."
1628339874,"An original online animated series starring actors from video games, film, and television."
1173416522,"Make 100! Get the fourth Chapter of the fantasy adventure webcomic, ""Suihira: The City of Water"" in print!"
1947140828,"HEY CHICOS here you can see my exclusive gallery and read my comics in your language, in addition to speedpaint videos and tutorials."
629315964,"We're making three high-quality enamel pins based on characters from the acclaimed webcomic series, The Middle Age."
877409669,Castle Elysium is the Sanctuary for two twin Sisters named Angel and Kairi. They will embark on an adventure that will change the world
1474088273,Next Town Over's dashing outlaw magician in fancy-pants cloisonné for NTO fans and pin enthusiasts: Erin rejoins the Make 100 fray!
664479861,"An adorable boy-meets-little-punk-next-door comic about friendship, family, love, and growing up. Help us bring it to print!"
2134338514,An anime/Manga styled comic that focuses on two twin sisters that mirror each other in every way. Their adventure will change the world
1714218473,"The 2nd print collection of Irregular Webcomic!, with the first 530 Cliffhangers strips. Archaeology, artefacts, adventure, aliments!"
78637310,Help us print the second book of Minna Sundberg's award-winning Nordic fantasy and adventure webcomic Stand Still. Stay Silent.
963189685,An anime/Manga styled comic that focuses on two twin sisters that mirror each other in every way. Their adventure will change the world
1111507316,Let's revolutionize the age-old cutting board!
624884597,"A high breed of tech bags that combine AI algorithms with a built in 4k Camera. From 25L, 9L, 60L and the 40L Ultimate tech bag."
1541048504,"A sleek, modern and robust watch with a damascus steel dial"
114771281,We’ve redefined toenail trimming with universal design principles for people who can't reach their feet.
1260228370,"A new beautiful piece of home interior that promotes undisturbed togetherness and focus,
and gives back control of your digital habits."
963043573,"A simple planner that helps you eat fresh and reduce costly food waste, that's 25% of the food and beverages you purchase."
1368249721,✅Launching ( Feb 2023 ) New Toy Everytime | Healthy Claws & Mind | Kids Family Fun | Eco-Friendly | Home Deco | Furniture Saver |
1580623492,Premium Design | Whisper Quiet Blower | Seebeck Generator | USB Power | Safe-to-Touch | 50% Less Fuel | 80 Hour Run-Time
1530651533,"Help bring to print ""Perfect Bind"", the first compilation book by Pen & Ink; two sisters that make comics about their lives."
1971758294,It's Walky! is a webcomic about alien-fighting superheroes!
155615968,"A woman accidentally gets billions of dollars! With no limits to what she can do, things spiral into depravity, ennui, and friendship."
294056540,"Over 100 funny cartoons (and a few serious ones), sprinkled with goofy doodles and silly tweets."
376946070,"A sketchbook compiling the sketches made for my own rendition of Inktober, highlighting witches of many stripes."
522395203,The third installment of Snow by Night! The winter spirit's quest for her heart continues as tensions rise on the frontier.
1532254696,"Meet Kitty! A former shapeshiter black ops android,  now with a ""Waifu"" personality, try to live (a)normal life on Frontera City"
1252055638,"Cheers to an uncommon romance between two guys, bi and ace, that look gay together."
756834190,Quinntessence is a webcomic about a magical detective who solves murder mysteries.
999123824,Where Is Zog? is a paperback collection of the HeavyMetal.com webcomic along with a new 16 page short story and tons of bonus material!
422298629,The Dreamland Chronicles is an epic fantasy spanning over 2000 pages and 8 books. This is the final book in the series!
502164284,"In Struggle-Town the streets are protected by Knockaround-Guy, a talking gorilla who fancies himself a superhero."
981583408,Combining the classic glass tumbler with a 1:1 scale die cast replica of a piston taken from the iconic turbocharged YB racing engine.
1507866648,"Powerful, versatile, practical and seriously updated. Introducing Litl Lochett, a lighter version to add even more applicability."
679360544,"Upcycled whisky oak barrel, hand forged copper vials and fine nappa leather amalgamate to form this exclusive personalized bracelet."
362474162,"Your All-In-One Pet Walking Tumbler
Multipurpose. Convenient. Portable. And dogs love it!"
451715379,Striving to make Genshin characters into LEGO minifigures for fans! We appreciate your support!
957834969,"Alcohol-powered portable stove for easier outdoor cooking. No gas, matches, or firewood needed. Just one click to start"
1346996313,"Just set the dimmer to your desirable flow rate. With its graduated flow rate adjustment, you decide how big your next sip will be."
359121156,"Cute and cuddly fruit-themed dragon plush toys, designed by a queer artist who loves dragons!"
1625510641,Mimic Bricks - BEWARE
1213441975,A stylish wrist-worn phone 📱 holder | hands-free phone accessibility for people on the go 🏃🏻
1427755529,"After nearly 50,000 sales of SIFTR 1.0, UN&I are back with SIFTR 2.0. The multi-use nesting silicone can colanders for your kitchen!"
818457421,"A glorious 90 + page full color print of Chapter 1 of Sacrimony - A Tale of Love, Life and Death in No Particular Order."
1116261298,Final volume of the reader-fueled webcomic about bad jobs. Includes guest comics!
1172705868,"It's finally here! The definitive, decade-spanning compilation of Danielle Corsetto's legendary webcomic!"
2075452343,"Help print the first book of The GaMERCaT, a comic about a cat that plays video games."
68418680,"A fun, unique calendar to help fund the next 12 months of free Cow Texas comics!"
945309267,FINDING DEE is a webcomic about the ins and outs of being a 40 plus cartoonist AND discovering yourself as a transgender woman.
300383763,Comic strip adventures of classic movie monsters
981254418,CREATE A WEB OF COMIC AND MANGA MULTI LANGUAGE with drawing tutorials (with 3cchi and hent4i) originals and doujins OUR.
1129273726,"The complete six-year run of the award-winning webcomic Narbonic, collected in a two-volume omnibus edition."
1992607617,"A webcomic and a website named
THE MISADVENTURES OF PROFESSOR ERROR"
2144820982,"Join three friends as they deal with death, uncover greed and a conspiracy in a dreary town called Rancidville."
1264532782,"The cutest, shortest, Anarchy Dreamers kickstarter ever! Preorder your copy of vol. 1 and help fund the second edition!"
170606687,"A city bike smaller with a sliding body, folding handles & pedals, faster dual speed gear, made with eco-friendly die casting process"
296013923,"Faiyoso means elegance and beauty in Syriac,
A new concept of architectural thinking.
Create Elegant ... Create FAIYOSO 🖤"
1439634701,Trooly Clean is a handmade soap company that brings you high quality ingredients with no harsh chemicals for an consumer friendly price
854805756,"The Pins - Come be a part of the Pins Family. Resin cast figures.
Collectible and fun."
2039267936,gdgdfgdfgdfgdfg fgd gfdgdf
1097963088,"Energy Flight Cases for Synergy, Randall MTS and Egnater Style Preamp Modules."
804084331,Never pick up germs from a countertop again.
1662308238,The Extra Hand You Didn’t Know You Needed.
814540223,Soothes and calms sensitive skin and promotes skin repair with the unique plant extract ingredient.
255608651,"A helmet that looks good whatever you wear, not just lycra."
1457227803,"One small step for you, one giant leap for our planet"
589375458,"An in-depth interactive guitar app. Selective layered fretboard chart, with legend and key. Understandable and easy to use. Inspiration"
1466390994,"Help us kick off a thrilling, ongoing anthology of fantasy stories exploring every corner of a rich, diverse, magical world"
479719608,One of the most influential female characters of the early 90's returns this year with a new graphic novel and Hollywood film
116393189,A rural fantasy comic about a student vampire hunter who gets stuck babysitting a werewolf over summer vacation.
2131694256,Collecting the comic adventures of Binwin Bronzebottom and his hopelessly-hapless band of Minions into their very first book!
1742287437,Classy hardcover book collection of comics...featuring everything you need to know about today's modern animals!
508504808,"Kids compete in city-smashing, all-out brawls using video game mechanics as super powers! Ultracute x Ultraviolent!"
612812811,SAKANA is a slice of life webcomic that takes place in a fish market. Volume 2 collects chapters 9-16 into one handsome softcover book!
91962152,Sensual and inspired comic retelling of the classic Greek romance of Hades and Persephone.
35028396,"Twelve more issues of women-oriented, LGBT+ friendly webcomics, light novels, and audio dramas in our digital magazine!"
1181000155,Volume 1 is now revamped and edited with a new extra story by Joberu!
1899717364,A print of the first 10 chapters of the webcomic The Sanity Circus
290650542,"Want: characters to be brought to life.. using Copic markers.
Belle draws daily, for hours, and has a story to share.
Help Art Shine!"
1765047287,The Smartphone Case That Cools Your Phone.
2029028119,"Una nueva forma de concebir las guitarras: innovación en la construcción y el diseño, toda la experiencia en la fabricación."
2064690268,"CupShot, El único vaso con 2 propósitos, que hará tus fiestas más divertidas!
Además es de fécula de maíz y se degrada de 90 a 240 días"
1504880202,Astrology cards for natal chart reading. The Planet Deck : 132 cards - each of the 10 planets + asc in the 12 zodiac signs.
368370982,"KeyValet is a compact key organizer that makes your keys comfortable, quiet, and easy to carry"
449678188,Revolutionary Magnetic Gaming chair for the Ultimate Experience
1466560822,Toy Bottle Caps That Make Our World Sustainable  サステイナブルな世の中をつくるトイボトルキャップ
478884761,"Build your own dino park. The set includes 12 unique dinosaur designs, build any 2 models at the same time. Fun for the whole family!"
88600177,We are making cute adorable Plushies & Toys of Clowns and Circus
896202028,Colourful knitted Pergolas light enough to brought anywhere from garden to beaches and forests
408632059,A unique Art Toy collection inspired by cats and peaches.
1735436955,Face & Props swappable mini figures from the mystery wood. An adorable weird creature.
1495503407,"A character driven comic, where an FBI agent’s search for a killer takes him to a small town in Arizona."
1759380220,A set of 5 adorable little buttons featuring the cast of the webcomic Validation.
2028727262,I'm looking to raise funds to print the first three chapters of my webcomic Fate in a full colour 126 pages graphic novel
825763155,"Colección más reciente de los cómics hechos por Alejandra Gámez para ""The mountain with teeth"".
Comics strips and little weird stories"
247911750,"Campaña que pretende lograr la producción de un tiraje amplio del webcomic ""Ari y La Cafetería de los Horrores""."
1498770808,A comic about adorably unadoptable cats living at a cat cafe that's owned by a big dude with an inner cat lady.
1187723469,"Romance, religious cults and catacombs! A printed version of the webcomic Purgatory, volume 1."
325854647,"Want a copy of the Trade Comics book? Pre-order here so I know how many to make!  It will be bound, black & white, 50 pgs."
354478833,Prints of Phase 2 of Sharp Zero (a fun LGBT supernatural/superhero comic) and new line of merchandise
2076176792,"Join us to fund Ménage à 3 Volume 8, Sandra On The Rocks Volume 2, and Dangerously Chloe Volume 2!"
1897975313,Anarchy Dreamers is an urban fantasy webcomic about sparkly undead kids fighting society's worst Nightmares. Let's print Issue 5!
1387700643,"The first collection of Melanie Gillman's extraordinary webcomic about a queer, black teen girl at an all-white Christian summer camp!"
615726468,Pharaohs to NASA astronaughts have used this method to sleep well
1728131975,"Unique signatures in Chinese by professional designers launched on kickstarter for the first time, which can brings new inspiration."
839108296,A simple Yes/No coin with Summer Smith from Rick & Morty.
383008856,Titaner Speedy Jump Rope with Titanium Parts & High-quality Bearings
1250594037,Educational Deck of 50 Cards
49368279,You call it the action-plan for New Year Resolutions. Most concise planner. Productivity system. We call it: The Focus System for life!
1548922207,The second enamel pin from Lightning and Lace featuring a crying anime style eye to really mmmMMMmmMMmmm capture that feeling baby!~
1012416353,To boost your energy and make it fun!
86196699,The powerful mount that tightly and conveniently holds your iPhone right next to the screen of your iPad.
286132772,"With D6 & D20 options available, Totem is the ideal boardgame upgrade, or ideal desk-toy. They look & feel like an ancient artefact!"
696305361,Love soda and beer? Enjoy your drink anywhere and at any time - discretely.🤫
1341688026,Create amazing 3D LED light structures | 1000's of possibilities | Plug Play Build and Display | Unleash your imagination!
1954181984,"Get all the full color and sketch art for Misfile, 6Gun Mage and others in one big book (and some other cool incentives to boot)!"
296581332,A full-color paperback for the webcomic! This snarky Magical Boy's Love story is about dudes in skirts fighting evil--and each other.
1870415017,"The trade paperback for the fifth and final full year of digital comic Cura Te Ipsum, written by Neal Bailey and drawn by Dexter Wee"
1800884903,"Toys and Monsters clash in an Irish inspired fantasy world, help fund bringing the first volume of Mag Na Mell to print!"
401104504,"Printing Volume 3 of Chirault, an epic fantasy graphic novel!"
116958518,"Join feudal Japan's two most powerful clans: The mask-wearing Oni and Fox clans, as they tackle both each other and daily life!"
300114172,"Help us print the second volume of Strong Female Protagonist, an ongoing webcomic about superheroes and social justice!"
78860406,"I'm creating super-cuddly, cute plush ducks so fans can bring Fowl Language into their homes!"
760790910,"Let's print the third volume of Unsounded, a fantasy-adventure comic about sorcery, hidden truths, and unconventional families."
1518590983,The adventure continues as Bow and Wizard start out on their journey to recover the missing tablet! And they'll meet two new friends!
231197329,"We're making the 6th print collection of Questionable Content! 300 strips, bonus commentary, and more!"
1802546189,"A woman accidentally gets billions of dollars! With no limits to what she can do, things spiral into depravity, ennui, and friendship."
774440211,A small piece From Nature: Unique Handmade Backpacks.
440831628,"Just a minimalist, slim, RFID protected, resistant, ecofriendly wallet with a revolutionary instant card release mechanism."
2084234474,"PourPur ensures your pet is drinking safe and clean at every drop, by using the premium material and latest technology."
490532639,Remembering Those Who Fought & Stayed Loyal To The Irish Republic During The Tan War And The Irish Civil War.
1988485686,"Celebrate 40 years of Eagle Force with NEW Classic 4"" Action Figures!"
1004462942,Creating 3D printed display models of historic locomotives to donate to railroad museums.
874239226,A bag to motivate us to live healthy on the go.
1635920540,A collection of adorable little house plant hard enamel pins and stickers
1589070268,"Bringing luxury, sustainability and goodness to the mundane world of deodorants"
615707878,"Fast, nutritious, & tasty meals. Parents, Business people, outdoors, or want a healthy takeaway alternative look no further."
1124438363,The complete sleep system designed for maximum comfort outdoors and restorative sleep at camp.
141738105,Vintage iconic lines are reinterpreted and combined with numerous unique design elements - 39mm diameter - 11.50mm thin -
744187953,Rucking transforms any walk into a workout. Lower impact than running - burns more calories than walking. Rucking is the new running.
2065315777,"The Alleyman returns with the Alleyway Tarot, Oracle of Secrets, and Oracle of Play"
1942691755,Egyptian goddess Cat Bastet
131926794,March 2023 Pin Club
1224650378,Make popcorn with your kids or good friends with your MC-05 PRO.
802137189,Support us now and we will also give you a free card bag made of genuine leather
1110440443,Build your own automatic watch with our full watchmaking kits or receive a fully assembled watch from our London workshop.
1170017748,Non-nickel stainless steel. Induction-friendly & built to last for centuries. 100% made in Australia.
291107540,"Two beautiful comic books about gay men, demons and monsters in original sexy stories! Fun, kinky, colorful, consensual bara smut!"
424719145,Mystery | Intrigue | Guns | Tea! Get ready for a new installment of the action thriller comic that is Madam Butterscotch
357435157,"Scopri come prosegue la storia d'amore tra Lasse e Mason, nel secondo volume della saga cosmica ""Samsara""."
410658967,Dumbing of Age is a webcomic about college and making bad choices.
343525060,FINDING DEE is a webcomic about the ins and outs of being a 40 plus cartoonist AND discovering yourself as a transgender woman.
994051305,"The story of the Coast Guard's coolest boats, told with humor, history and pictures of ships wearing hats! This will be my second book."
1869090630,Comics about Veteran life in the civilian sector.
696723957,We are bringing everyone's favourite warlock from Looking For Group to your world!
1505717652,"Help turn the first five chapters of the webcomic ""Children of Eldair"" into a book with over 150 full color pages."
635562262,44 page comic book collecting every Me & the Kid comic strip over the past six years from Gopher-it Comics.
1037328206,The first chapter of Jemma Heiss' biggest job as she is about to take art theft out of this world. Come out and #jointheheist.
393128677,"Help Mangatellers fund the printing cost of the webmanga ""Sphere of Salvation"" (aka S.o.S.) in one glorious tankoubon!"
1026568295,The tag offers free engraving and is a very meaningful gift for your friends
1587845674,"Let's make our weekend, completely different, from Havens"
351120301,"[A4 compact design] Design that focuses on functionality, storage, and portability."
883393146,"Rotating belt buckle, double-sided different color belt, free mini portable light"
401589437,Frogs and cats with their favorite snacks
1549874539,A useful and nice little knife for every day
1515369078,"Covering tool conditions such as carbon steel HSS, DLC coated, full cut, convex, etc."
236880604,"Breathing life into the Apple Watch band, creating a design of its own."
1205855920,Hard Enamel Pin about Japanese Sexy Manga.
1358146337,The desktop space is divided into 3 levels to maximize the preparation of more storage space.
100585065,"Tweaked blades and assembly in our all-rounder manual hair trimming tool. The unique, truly #sustainable #beard #razor"
140856050,"Charging by adsorption magnetism, not afraid of dropping, can charge the phone and watch at the same time."
513230722,"More love, more girls, more beer! Help us bring Book Two of this series to print - while we also reprint Book One!"
1587259689,Volume IV and V of Cat and Girl! An indefensible 536 (total!) color pages of (often!) black and white comics.
1715724102,"Bringing even more adventures of Emma, Warrick and the gang to print! Contains Intermission 2, chapters 11-15, and various extras."
1594874348,The first half of the epic misadventures of a bunch of fantasy adventurers! 300+ pages of award-winning webcomic in print.
1433741066,Paradox is a sci-fi comic that follows a young man as he fights to prevent the paradox that created him and is destroying reality.
1516570491,"The end of sophomore year: a time for first jobs, first cars, and first breakups. But nothing is that simple in Roseville High!"
396830435,"Political commentary, comic strip/cartoon to explain human rights issues and feminism to mi hijo. Born from Women's March of Jan. 2017"
1836968598,"Hey, I'm attempting to get the first arc of my webcomic ive been doin' for a few years collected and put into print."
1018102044,"2 new books from Aurora Award-winner Rock, Paper, Cynic ft. comics about being yourself, blood magic, pop culture, gaming and more!"
2106175965,Help fund the printing of the 4th volume of the sci-fi adventure webcomic Nextuus: The Search for the Ocean Shard.
1728900801,"This is the 3rd print collection of Nothing Better - a comic about life in college, focused on odd-couple roommates Katt and Jane."
2029548622,Volume 2 of Monster Pop!: a slice of life romcom published online since 2012. See chapters 3 & 4 in print with KS exclusive extras!
1966692365,3d models for 3d printing in STL format
1453310507,3d models for 3d printing (high detail)
1290109044,Laser cut wood and Italian handmade flexible couch arm tray with coaster and snack holder now in 36 combinations of colors
1349911042,"Building a perimeter wall with armored gate to securely house BRIC - Building Resilience in the Congo. Total cost is $10,000"
411299849,A pocket fountain pen with an unique urushi finish
76776465,You can have a wood stove! You can enjoy solo camping in an executive space!
1224643259,"A solid and simple wood-chopping hatchet that pursues the ""beauty of use"""
641959210,A patent pending magnetically transformable flashlight&blade. Everyday carry&Easy use.
544569698,A coin designer's art project to help motivate and inspire.
1949856041,A professional framework for Business Aware Design.
1981660414,"Waterproof , Dust-proof , Drop-Proof , Multilayer protection with Easy Cap"
1027954654,One-button automatic inflation. Mobile inflatable sofa to take with you
1671661986,"Next Town Over's cold, laconic fury in fancy-pants enamel for NTO fans and steampunk enthusiasts: Erin joins the Make 100 fray!"
1874233413,"Series debut of a comic with spaceships, aliens, the fate of the universe and a family struggling to hold together in the thick of it."
2099951370,"We're making a book that contains all of the completed webcomic Let's Speak English, along with bonus content!"
1222861690,Help us print MULTIPLE volumes of this hilarious romantic comedy! This comic is a (screaming) love letter to shojo manga fun.
430737567,"Help this creator-owned frontier fantasy comic full of steam, sorcery & secrets collect and print its second volume!"
210158965,"Two hilarious new books about being a lady in the startup scene, and the quest to achieve peak awesomeness."
1422525372,"Time for new volumes of The Cyantian Chronicles, plus new color editions of Akaelae #1 and Akaelae #2!!"
1154808003,"Table Titans: Winter of the Iron Dwarf, Collects Season Two of the D&D Inspired Comic by Eisner Award-Winning Creator Scott Kurtz."
827800776,A book collection of over 300 daily comic strips about a guy who talks to himself.
657944766,"The 3rd book in the galactic adventures of astronomer turned superhero Danica Maris, aka Star Power."
1029107569,"Collecting the latest four chapters of Plume into its third volume, Kickstarter exclusive hardcover edition, and trade paperback!"
144515436,A horror comedy about a repairman who was in the wrong place at the wrong time thanks to mad scientists and monsters.
1811963974,help fund your new favorite fluffy and cute plushie companions. the animal trio you didn’t know you needed.
1273993956,"If you have more luggage, you can expand your backpack and fanny pack at the touch of a button."
1714575518,A collection of enamel pins inspired by the study of insects and nature itself.
1821522742,Answers from your favourite heavenly body & the brightest star in the sky! Mini-art print featuring 11 different celestial answers.
626542082,Creative Storage Solution for Any Adventure
1808476405,3d models for 3d printing in STL format
2062486653,For TCG players and collectors!
1279339521,Titanium alloy design | A compact and stylish way to decompress anytime! | ADHD Autism Sensory Toys
101363207,Pass along wristbands and apparel aimed to help spread kindness & compliments around the world
379260144,"Dream Big, Little Peanut comes to life with a handmade fox doll designed with a modern aesthetic reminiscent of vintage toy design."
296670767,A pocket calendar with common metric conversions
310827914,"Limited to 100 pieces, these card holders reduce the bulk in your pocket while carrying bank or business cards"
1480840624,"A printed collection of comics primarily about life, dating, and relationships, and occasionally about sex, drugs, and web design."
1387193023,Everyday People Cartoons by Cathy Thorne presents the 2017 calendar!
261216264,HACKER FIGHTS. DOUBLE LIVES. NONSTOP QUEER CYBER-POSTPUNK ACTION. Collects chapters 00 and 01 of the ongoing webcomic!
1280440252,"The twelfth and final collection of Unshelved, a comic strip about a library."
225684640,"O Human Star returns for Volume 2, plus a reprint of Volume 1! Available as softcovers and KS-exclusive hardcovers!"
