id,blurb
2004096427,Magic Morgan & Liliana are raising funds to expand their famed traveling magic show to a theater of magic.
811595825,"a magical place for all kind of people, like a fairytaile in all colours"
779505993,"Our mission is to offer an innovative family watersports attraction that is fun, safe, economical and a leader in its field."
1141808048,"A community space in Somerville, MA to celebrate the beautiful intersection of sports and creativity."
1149481574,We are a small theatre company looking to provide world class theatre to the working class in the Greater New York area.
145247916,"Performing Arts workshops, for young people aged 5 -16, exploring how the sea has shaped Cowes as a settlement."
1504811926,"The King of ABC/Y boxes : Triple-output, noiseless, transformer isolated magic."
549764106,"High End Audio Amplifier board with up to 100W per channel in dual mono. For Raspberry Pi, compatible with Asus Tinker board and others"
1795703664,A modern reinvention of the MIDI router    by CONDUCTIVE LABS
255154404,A creative and musical looping device.
1176693789,Magnetically attached modular subunits. Used together or separately for premium wireless surround sound | Bluetooth |
88259739,"The World’s Most Advanced TWS Earbuds with patented crossover and dual 6mm
dynamic drivers, delivering the incredible stereo sound."
728626666,Nonstop playtime is instantly available by hooking up the sport and w/ built-in battery via magnetic.
1962143465,"TWS surround sound |  Bass Reflex System | 95dB ultimate sound | Only 0.98kg | Bluetooth 5.0 w/ Qualcomm aptX, aptX LL"
785192158,BT 5.0 speaker | Support wireless charging | Original vintage design | Dual 5W speaker w/ bass reflex system | Built-in battery
1255424808,"BT 5.0 True Wireless Earbuds Based on Qualcomm QCC302X Platform & amazing sound quality, IPX7 Waterproof, Hi-fi Sound, Touch Control."
2035769832,hörbert mit Bluetooth-Kopfhörern benutzen / Use bluetooth-headphones with hörbert / Utilisez un casque bluetooth avec hörbert
321151717,High-Resolution Audio | IPX6 water-resistance | Unique true wireless earbuds that are stored and charged inside a fitness band
1321079928,What happens when you get a light bulb stuck in your mouth?
184224893,"We are creating another sketch for our ""Comedy with Errors"" series."
738072872,A film that follows 4 students who decide to plan a heist on the last day of year 11.
1778070056,"Lou Warlan, an American comedian struggles to maintain his sanity as he works his way up the ladder on the stand up comedy circuit."
188860178,"Newly restored & scanned from an archival 35mm nitrate print, and featuring a new theatre organ score."
1973299539,A witty & dark film about the internal turmoil of a closeted homosexual man who is newly retired and must come out his wife of 35 years
1411050115,"An 8 episodic series titled ""Not another DND series"""
1715212617,"A short film about three ambitious filmmakers trying to write a heist film, but a waitress convinces them to rob a coffee shop instead."
1767665170,A short film about two ex-girlfriends and a dying rabbit.
2015897098,"Two eccentric 80-year-old friends, Walter and Dennis, living in a nursing home, unite over their love of cross-dressing."
1571536026,Help us finish our film! A comedy-mystery about modern relationships and mental health.
767424945,Help us livestream another series of Richard Herring's Leicester Square Theatre Podcast!
548096646,Super squishy guinea pig plush with magnetic food accessories and matching enamel pins!
721456328,"Juego de 12 piezas de madera de pino puro desestresante, creativo y motivador. Crea tus construcciones y abastracciones artísticas."
248348403,In Japan there are Daruma dolls. You make a wish and the Daruma will keep it inside until it's fulfilled. Put your wish into the coin!
1764677070,The world's tiniest EDC bottle & box opener + stylus pen + flat screwdriver with a free laser engraving option for your names/logos.
508076500,Lightweight. Incredible sound. Loud and long sustain. THE carbon fiber concert ukulele is finally here.
215638183,"Help bring this adorable, squishy, Sea Pancake plush to life!"
1780163729,"Sailor Moon Character hard enamel pins based off their original maid cafe design, featuring more characters."
285656263,hook what YOU want!
431607496,The first portable printer to print on food and more...
1294647067,"Massive Stützplatte für die Schwerlast Kurbelstützen von Caravans, Wohnwagen oder Wohnmobilen bis 95mm Breite."
52085690,"Collection of cute glassware, pyjama set, accessories and more."
25905815,A geek toy with which you can show the stages of cell division.
228899844,"Help Genesis7 produce, release, and promote a POSITIVE soulful HipHop & Neo-Soul compilation album LP. Music Matters!"
1687387620,"The Debut EP for San Diego native Ryan Nealon and his group the ""Ryan Nealon Band"""
771440068,"Recording Artist, Sherry Amour would like to partner with you in creating music history! Support her recording project, Mirror, Mirror!"
1521872439,"The Creation and Distribution of Indie Artist, Kelechi Kalu's  Debut EP, Room With A View +Music Videos and  2nd Untitled EP"
2056114648,"Minneapolis garage gospel band Gospel Machine are releasing their debut album, ""Your Holy Ghost."""
383352922,"An LP steeped in nu-funk, touched with delicious soul and tasty hip hop. Help finish the album!"
692416087,Music Video and PR Campaign to promote single 'Love Blind' which aims to raise awareness of domestic violence.
575843807,"The Zen Hussies are seeking crowd funding to assist in the realisation of their stomping fourth album on 12"" vinyl & digital formats."
902117890,I've been singing in NYC subway stations for 25 years. I need your help to complete my album of soulful originals & classic renditions.
1867256240,Yellowcake is hitting the studio to record our first full length album!
175326585,"2015 Goal=EP=Music Video=Tour=sharing & connecting with people=1 step closer to the dream
Please get behind this & support my campaign"
1840280481,"Amy Banks explains how ""AlI I Know About Love I Learned from Aretha"" during a live concert recording with full horn band and singers."
1631608864,"I've crafted Maria's Recipe Book to afford my graduation fee. In it, you will find 70 easy and delicious recipes to pamper your stomach"
1845834400,We'll feature you and your recipe in our cookbook. Makes the perfect Christmas gift for just $1
458173856,Not all great tasting recipes get the Blue Ribbon.
1855100661,A Cookbook in a Universal Language at $1.50 per portion!
1939711092,"An Ancoats and Northern Quarter cookbook. 
Celebrating the independents on the local Manchester food scene... ""It's Cooking Good!"""
1019137504,The No Deprivation Diet cookbook is coming your way!!  This cookbook will have all your favorite meals and not leave you hangry.
54414302,A Soul Food Cookbook from Chef Affron.
1174599117,"This pie book, called Pie Day, will memorialize my Mother, Evelyn Reiss, who taught me to share and love through baking."
1495049771,The Story and Recipes of Valerie's Cat Eye sCream! Is a hand drawn graphic art ice cream recipe cookbook & story of friendships.
1291688465,"Unlimited access to a curated collection of hundreds of the world's best cookbooks including more than 100,000 recipes"
1735972361,Easy Unicorn treats! This cookbook (made with my mom) gives you & your kids the chance to create your own rainbow colored masterpieces!
1262782096,The world's first cookbook for the waterboiler
1233193010,"Join us in our quest of finding Christmas Magic, capturing magical moments in photographs and stories as we begin our blogging journey."
1508437456,This November I will trek the most extensive route of the Silk Road ever attempted in modern recorded history by walking/bus/train.
246887725,"TUSDE seeks to create a record (w/ pictures) of the campus squirrels at South Carolina: names, favorite colors, weaknesses, etc."
2144908095,"10 yrs ago in Ferris, TX the chupacabras ate my goats. With your help I hope to prove its existence once and for all."
537453295,We are a small time Perth Automotive photography company that are looking to release a new magazine covering the Perth car community.
1153446740,"My project is to move back to Dallas, Texas. I want to take pictures and document my entire drive back and experience for 1 year."
337444610,Donbass: A Change for Childhood is an initiative led by Ukrainian American community that aims to support child war refugees.
1452753701,A dream that turned into a goal that with help will be reality. Rosetta Stone is just a web site this will be a life long experience.
100590427,A remarkable story about the ordinary men raising the next generation of African elephants.
523474062,"Help us document the myths, legends, and legacy of aviation in America's Southwest through photography and print!"
1582810671,Kelsey and Stan are planning a road trip from San Francisco California down the pacific coast to Los Angeles stopping at awesome places
1313420838,Media tends to focus on the sensationalistic.  FOR will be a photo journalism book that shows how beliefs plays out in ordinary lives.
1334768689,Save JRR Tolkien’s home where he wrote The Lord of the Rings and The Hobbit and establish a writing and creative centre for the public
792375602,"A writing retreat, networking, educational, and publishing resource for diverse and inclusive writers"
1202094837,"Histoire sur la possession démoniaque, mélangeant fiction et témoignages.

Story on demonic possession, mixing fiction and testimonies."
1550577164,"Methodology of a speculative temporal philosophy:
A new interpretation of practical philosophy on the background of timelessness"
1334347072,Una experiencia en forma de caja en tu casa con libros y detalles para la lectura. Haz de la lectura tu mejor momento del día.
2105448797,Where Your Writing Can Come to Life!
545853760,Creating a website to showcase my upcoming work where I focus on the intersection of the monstrous and the sacred.
1459791846,"Curiosi e un po' strani? Venite fuori!
Un luogo differente e multifunzionale dove due passioni si incontrano: tè e (inconsueti) libri."
1639960941,Positive stories and testimonies of people around the world on pandemic times
451192325,Diferentes historias basadas en leyendas de estados de Mexico
467787651,"Quale episodio della tua vita merita di essere ricordato? 
Mandamelo, lo inserirò nell'antologia (pubblicazione luglio 2020)"
1477219070,"Crear una saga de libros de índole fantástica, con la finalidad de ofrecer al lector un historia diferente a lo visto."
1117822535,A dim-witted sasquatch bumbles his way into a series of woodland adventures in this award-winning comic series.
791391915,Books 1-9: LGBTQ For Better or For Worse / Urban Fantasy / Drama / Romance / Two Dudes. One Tub. Intimate Philosophy / BL subversion
73955369,"LGBTQIA+ BIPOC Romance by a Non-Binary BIPOC Creator, with a Happy Ending and Erotic Epilogue. Love At First Swordfight!"
1365711738,College trackstar Violet is bored of her routine life when a mysterious military leader releases a deadly virus on her futuristic city.
805898234,"Volume 3 of the Award Winning, LGBTQ / Slice of Life / Urban Fantasy Webcomic, BUUZA!! is coming to print!"
829598398,A story about two vacuums who learn to live together.
607044084,A comic about finding yourself while raising the dead.
1388193654,"Help print Book 2 of Everwake ~ a Steampunk-Fantasy adventure about mystery, adventure, and romance."
845504907,"Volume 14 of the webcomic Zos Kias, featuring chapters 66-70, the continuation of the vampire arc!"
201886176,Comics based on real life mobster stories like the time the US government enlisted the mob in WWII. Truth is stranger than fiction.
1130243474,"A comic about a well-adjusted mouse, learning to share the world with Anxiety."
146435544,A campaign to bring the classic sci-fi webcomics to print for the very first time!
2147150131,Don’t miss the magic of sound innovation on electric guitar.
1471166724,"The first sidechain compressor triggered by audio, analog gate/CV, MIDI, USB and even a pedal, for unprecedented creativity!"
1346214713,"BassMe brings your senses a new dimension of an elevated auditory experience, immersing you in your music, movies and gaming."
1225241789,"Senspad, more than a drumpad, this is the new generation of drums.
Bring your drumkit into your bag. No constraint, be free."
100788089,Portable Bluetooth speaker with amazing sound and a stylish look.
1340119160,Wireless Earbuds & Speaker Based on Qualcomm QCC302X Platform | Bluetooth 5.0 | 40H Playtime | All-Day Battery | Clearly Superior Sound
1185481991,Sensor interface for Eurorack Modular Synthesizers
1887240939,"High Performance, High Comfort Bluetooth Noise Cancelling Headphones With Dialogue Clarity Technology."
424228171,Explore the Natural Systems and Lesser Known Fringes of Analog Synthesis
152045021,Buzzzy! is a 16 voice / 4 part digital USB & MIDI module with 4 synthesis engines and quality built-in effects.
2074724561,Dove Audio Waveplane Oscillator module for Eurorack or MU modular synths.
1717439197,The Pill is a Sidechain Compression Pedal made in Europe. It brings a music production effect to the live stage. Bounce responsibly!
1258274014,A fun QUEER reimagining of Cyrano de Bergerac.
1643121792,"A short film about femicide, the Afterlife and changing fate."
2073876622,Dark Comedy short film set in a world where most women choose to have children on their own using donor sperm.
1538697351,"When her extravagant bestie arrives to the party uninvited to smoke up, the affable Olivia teams up with her to survive the toxic party"
1939975687,A new queer slice-of-life comedy film about two ex-lovers stuck together during the beginning of quarantine.
81818898,A half-hour sitcom pilot episode
1970482877,English Breakfast is a short dark comedy film about a young newlywed couple whose honeymoon doesn't quite go according to plan.
304126355,A dark comedy short film by students of Sydney Film School.
713534752,A comedic feature film about scammin'
1291070697,"A 12-minute Short Dramedy about the Absence of Family,  the Rapture, and Dogs!"
1645622481,Love bites. And strangles. And stabs.
989561090,A comedy documentary exploring British attitudes to sex and relationships... in Norfolk.
247661338,"Owlopes – A magical, memorable way to deliver messages and small gifts!"
404228939,"TP4 チタン万年筆 / EDC Titanium Pen: Small, Lightweight, Durable, Everyday, Everywhere - TP4 Titanium Fountain Pen is your choice!"
1254087123,"Natural beauty in your kitchen, Hera series of wooden accessories"
366142450,A minimalist rechargeable safety light for your bike's head tube - leaving room on your handlebars for all your gear.
660887867,A new generation of anti-theft bags that combine sleek & functionality.
87699543,"Not just combined phone wallet and phone stand, turn your phone STAND HORIZONTALLY AND VERTICALLY in seconds"
1830215958,Help bring Kaz & the collectable Squiddies to life! I'm making 100 art toys – turning my 2D art to 3D printed art for the first time.
1074024915,"a super cute ita backpack of luz' palisman, string bean & an adorable string bean candy shaker !"
174289324,A cuddly friend to get you through the harder times in life.
25220749,Handmade glassware without the handmade price tag. Michelin Star-approved balance of elegance and affordability for every wine enjoyed
655876613,Enamel pins and stickers of magical characters.
1633672652,"Perfect for partners, the Pair Married Couple Sake Cups represent a strong marital bond, with a brass base to keep the cup stable!"
474724499,We are creating a mobile community devoted to the spreading and sharing of spoken word and other kinds of storytelling.
1290886509,Restoration of a theatre to make an educational center for youngs and a place to socialize for everybody through the power of art.
1585568944,Wij willen Tropicana het subtropisch zwemparadijs van Rotterdam op een nieuwe locatie gaan bouwen.
1546578425,A series of 6 educational theme parks. This project is to fund the plans and 3D designs required to build the first park.
1597408943,"Création d'un théâtre de marionnettes automatisées et informatisées portant sur la nature et l'écologie.
""La symphonie du monde"""
509310783,I would like to screen this documentary at CSU at their Black Studies Dept. Looking to fly panelist in. Hoping to screen nationwide. <3
1512909154,"Help www.KidZoneMuseum.org grow to serve children 1-18 with science, engineering, arts and PLAY especially low-income families."
1008454668,"A magical space, full of fairytale favorites, designed to make each individual have a unique experience; children's dreams made real."
1698292898,"YOUR community theatre:  provide a facility that is usable for presentation of movies, live music, live theatre and community events"
239895758,"An epicenter for connection, creation and expression of the community."
1529447129,"This center will be open to any and all people regardless of their religion.   We will be offering art, music, empowerment, and more!"
1175355494,"Help expand the time of everyones favorite magic store!  It currently limited to 3 days a week. If not for you, then the children!"
1478184464,Thank you for your support. Im currently finishing up my latest project. Getting back to that feeling I had on my debut album!
55085407,Please help the TCB finish their 2nd album! Spent $4000 of my own money but need some support to complete the project. Thank you!!
906797964,"Hi Alice Fredenham here, you may remember me from Britains Got Talent 2013 . I sang My Funny Valentine.  hoping to make my first  album"
94522325,Taking to the road to share the stage and connect with incredible indie artists all over the country!
1520693488,"Chris Daniels & The Kings featuring Freddi Gowdy need your help to complete their brand new ""Funky To The Bone"" album."
1945636203,Michael Lynche and The Black Saints are touring to bring good R&B music while empowering and encouraging young performers of tomorrow.
687918647,"I am releasing my very first project ""EP"" titled ""Won't Do It Again"" I need help with contributions pressing up copies for the EP"
850364324,Chicago home brewed psychedelic soul stew. Breaking the mind body barrier.
1260531977,"I am creating my 5 song EP titled ""The Musician Next Door"" and would love your support by backing it! Much love and light to you all!"
1240649713,"We have our first four tracks. Time to kickstart our mixing, mastering, marketing, and merchandizing to share our music with the world."
1568031794,I want to share a new album of songs w/the world! Everything pledged beyond my minimum goal of $4000 goes towards my FLEX GOALS! Read->
57449907,"We're Everyday People, Stanford University's Motown, Soul, and R&B a cappella group.  We need your help to finish our new studio album!"
703504858,A cookbook with a mission to support the people and the organizations who protect Africa's vulnerable national parks.
993097818,"Easy, essential techniques & recipes for Roti's & other popular Indian flatbreads presented in this master class styled cookbook."
410542533,Award-winning chefs deliver a taste victory for those undergoing cancer treatment—and anyone who loves food.
1685647298,"A unique Italian lifestyle piece with beautiful illustrations and colouring pages, full of grandmas’ cooking secrets and tips."
224029306,"The Vain Cook's cookbook is a funny, friendly guide to mastering ego-boosting recipes without wanting to burn the kitchen down."
220161448,"The first ever Recipe pack from Hobbs.
Get it now so you can try my food for yourself at home."
462070335,"A photo essay exploring climate change landscapes through the vernacular of eating—future visions of ingredients, food, and recipes."
1308862681,"A cookbook featuring the delightful bite of Ginger KICK! candied ginger. Sweet, Savory, and everything in between."
2028763189,"A 2nd set of recipes from the show ""Gilmore Girls"" - the follow-up to ""Eat Like A Gilmore"". Scroll down to learn more."
1753417142,"Part comic, part cookbook, Toby's Table preserves over 20 recipes from dinners to desserts with illustrations by Toby's granddaughter."
2053540504,"Primer proyecto editorial de la gastronomía de la región de Colima, en México. Con una investigación de más de 10 años."
698517178,"The Millennial Cookbook is an underappreciated, hard done by hardcover recipe book made by millennials, for millennials."
610472324,We are hosting the BIGGEST masquerade party in Europe and you can be a part of it. Send us a picture of yourself to join.
2145619213,"I want to see what it is like to go on adventures. Visit Sweden, or Alaska."
1247730172,Have you ever gone to a bathroom and didn't want to use it because it was dirty? post your pictures Air it out here we hear you.
386802904,"Journal and Photos of former military spy. Photos from Vietnam, Germany and the U.S."
1292412774,"These photos will document SpaceX building their Boca Chica, Texas spaceport."
1334097655,Coverage of Israel's latest conflict has centred on Gaza: I have missed background media coverage of Israel. I will go shoot it myself.
262174391,"We've been together over 2 years and it's time to make the big move! We have a plan and we have each other, now just time for a ticket."
844541369,"Russian orphans need you! Bringing stories and photographs of Russian orphans to Europe, we will facilitate their adoption."
108631766,I would like to make a photo journal with details of how children see the the world . Using my own children and there experiences
717627033,"After surviving serious illness, hurricanes, abuse, divorce, poverty, it is finally time to go home!"
40253542,Hi! I'm Amanda and I want to raise enough funds to sail the Caribbean islands. I will be documenting the trip through pictures & video.
1058407729,"I'm going to document America, from The Middle to the East Coast, then to the West Coast, then back to The Middle."
1745465454,Hearing loops will be installed in theaters to give hearing loss sufferers with cochlear implants and hearing aids much needed access.
1392972453,Our goal is to purchase a theater on the Upper East Side of Manhattan that will act as a home for four theater companies.
1549745357,In our 30th year we are relocating to the world famous Choo Choo on The South Side. We will be remodeling the old Station House.
417140500,Get behind a new music venue in our city by helping with equipment! We're pre-selling tickets to our party and offering other perks.
942983385,Save the historic Roxy theatre in Bremerton WA from being repurposed as office space.
355231782,"Help fund the exciting first collaboration between Hotel Echo and Bristol Cathedral: WILD MEN, a show commemorating those lost in WW1."
699243242,Help! is a full scale mobile theatrical musical bringing a Gospel revival through a story of love and hope to communities world wide.
523580206,"Host a special event in your home, collect donations and turn containers in the foyer to a comfortable welcoming place to sit & chat!"
2081624657,"Helping female comedians get in their 10,000 Hours of practice!"
1062465950,"This is a Kickstarter to help with the start up costs for Illusionist, Chris Lengyel's Summer 2016 Tour!"
1449820256,A memorable theatre experience in the middle of Genoa's old town. Summer is coming and we have no intention to stop making you laugh.
1896558868,"Labellisé 14-18, Mots Écrits est un projet itinérant de lectures à voix haute par des amateurs, mises en espace par une comédienne."
8384225,Time to bring Bitty's senior year at Samwell to print—are you in? It's the end of the series...IT'S CHECK PLEASE: YEAR FOUR!
996636285,A celebration of FAILURE in all its forms from webcomics author Mr. Lovenstein. Join the party and help us fail up!
930563449,The sixth collected volume of the adventures of a scurrilous pirate with a magical cat for a beard!
160943085,"Flying toasters, magical coffee shops, and adventure! Book 3 of the silly fantasy adventure comic Sombulus is coming to print!"
651475974,"The spicy adventure in Wonderland of the stunning Angelica!
4th Episode of ""Angelica 1946"""
147943442,"The second volume of a comic about soldiers and smugglers in 1920s Poland. Sometimes silly, sometimes serious."
523170018,"2021. Les adultes se sont fait vacciner contre la Covid-19.  Malheureusement, des effets secondaires surgissent. De tragiques effets."
1021434719,Dumbing of Age is a webcomic about college and learning your parents maybe have some bad ideas.
354849321,"Help fund Library Comic's first collection, then vote on which comics it includes."
572869832,Life in the ‘Quarter isn’t just cute shops and witchy neighbors... It's time to print Episode Two!
1146015396,Collecting chapters 1 through 4 of the genderqueer swashbuckling adventure webcomic!
407404114,"Inspired by your favorite anime's, comes an unpredictable story heavily influenced with Egyptian mythology.We are all kings Descendants"
914596511,"Publishing audio CD & MP3 visualisations to be used by actors, students, teachers, lecturers and in-flight entertainment for relaxation"
1538066685,Coming Out in the South Book & Speaking Tour
786987919,Historia del Estado de sonora y todos sus pueblos
822146677,"The history of female consciousness through intrigue, deep psychology and sacred sexuality"
544074803,The right book to understand the structure of german language.
1733519440,He escrito una novela apasionante de fácil lectura que quiero publicar y traducir a varios idiomas
231401629,"Bishop Arts District (Dallas) needs a quality and budget bookstore.  You can help achieving that.  Read on, fellow booklover!"
