id,blurb
961324776,"Ultraportable, Foldable, Lightweight, Comfortable, Waterproof Everyday Shoe For Men and Women"
1535550142,Enjoy a better drink experience.
1958790277,"The world's most versatile stretch rain shell. Packs into its own sling bag. The perfect jacket for travel, outdoors, everyday."
136200018,"A magical pillow that lets you share hugs, warmth, & physical touch across the world."
1464521520,14 Days Only! The 5th coin of 12! Only 150 Silver and 300 Copper Produced. Catch up on the series with our Catch-Up Pledge Level.
1923594109,"Sleek premium writing instrument. Also available in aluminum, brass, copper, and stainless steel PVD. Works with parker-style refills."
282385648,Magnetic function|5-in-One|Titanium frame|Sunglasses|Near/far-sighted glasses|Night Glasses|3D Glasses|Gradient Glasses|Anti blue light
1987361121,Mothman and Baby Bat want to be your friend!
868895436,"Add tap water to WONDR powders to make your quality hair & body care, full of superfoods and no nasties."
600227447,Claim your rightful place to conquer the purgatory and spread stories among warriors! A webcomic series based on the reader's path.
1727968474,"A 20-page prequel story to kick off the next year of art, writing, and world-building!"
812805182,Our take on Sweet Tooth and his passion for killing
427451044,"ORIGINAL page art for my upcoming comic series, Inherit the Earth - an action/fantasy epic."
763886562,A new official home for Batman & Superman
1774274263,I want to fulfill a long forgotten dream..to share my Manga whit the whole world that everybody can enjoy and maybe find themself's in
1537012111,"A high quality web comic about a Space opera: adventures of action, drama, horror, and the human condition."
2115544423,A webcomic series about a gothic nurse who uses the help of her friends from the Underworld to treat her patients at work.
199072375,"Vita, es una historia de ciencia ficción, con base en historias sobre criaturas malignas ( demonios) y divinas."
1543701902,"A trade paperback collecting the first five issues of the ongoing webcomic ""Dreamland."" Includes bonus never released preview issue!"
708114634,A book of sketches collecting the Gods & Spirits drawn during Inktober 2018.
241081588,Volume 1 (first arc) of my MK's The Strange Case of Dr. Jekyll and Hyde in print.
1993627590,"MYNI, la collection de soins corporels la plus écologique au monde"
2059842344,An interactive photo book that lets you include and play videos from your printed edition.
1590798128,Brass divining tool that harnesses the power of light to access your subconscious.
847945471,"A pen magnetically transforming into mini & full sizes, resists the gravity on its special table. It is also an EDC pen on your pocket."
156028616,20 cm Childe / Foxtalia Plush and Ganyu & Kokomi as extra/stretch goals
106093741,Plush Pre-Order for the originally designed Long Cactus Cat plush!
1431974939,"Another series of cute buns inspired by fun, food, and mythology <3"
1863056790,A tabletop fire pit
601211517,Tiny corporate scum that you can cuddle with.
1598898287,Plushies based off popular pin designs made by NaysPinClub in 2019/2020 brought to life!
1056493058,The statement bracelet
21449006,The second part of a collection of hard enamel pins featuring mysterious and magical witch familiars.
1665349055,Imagine the Prophet of God and A Crazy Ex-Priest killing a few demons and saving the world from the Apocalypse. Fast times in C;TP.
312739339,"What happens when an ""ex"" crazy-cat lady  becomes a pharmacist? Find out now with Rita (Ritalin), Zac (Prozac) and Morph (Morphine)!"
990323037,"Una combinación entre cómic y manga, acerca de probablemente una situación irreal que ocurrirá  en unos cuantos años con la humanidad."
84300912,The story of a superhero and his therapist. A hero who struggles with mental illness while using his soul to fight crime: the Auran
531934011,Epic of action and romance
1740923657,The battle of the programs started...
1003886371,Active Comic series delivered digitally to your selected platform.
1689193810,"A physical and digital book collecting the best Car & Friends comics so far, along with TONS of extras/exclusive content."
376997564,A web comic following the story of Luke as he navigates through a world built upon lies and conspiracies to find his missing sibling. ▲
926842801,"I need to keep costs while working on the comic! It will feature an amazing fantasy story, but it won't be easy if you don't help me!"
1080951457,A printed version of my online Comic and Novella series.
690619669,"Is it true that the shooting stars can meet desires?
Would you go into a dangerous adventure to fulfill them?"
140150058,Cute adorable nine-tailed fox soft plush toys!
1751360885,Collectible 3D printed figures inspired in the Legend of Zelda characters.
1633880997,Swordfish is our interpretation of the ideal diver watch.
205828606,A cute & geeky cat-themed hard enamel pin Kickstarter by Myuna Art
1327471703,"A brand new way to stay beautiful all night long! It combines your must-have tools and makes them compact, portable, and customizable!"
901370588,"Most affordable automatic GMT, all Sapphire Crystal and all 316L hardened for scratch-resistant, 200m WR! Delivery starts Oct 17, 2022!"
1951239478,20 Auto-Adjusted Grind Settings | Unlimited Brewing Options | Curated Bean-Specific Recipe | Top Third-Wave Coffee Partners
811532894,Awesome Design/Waterproof DuPont™  Tyvek® /Best Dark Walnut Wooden/ Take It Anywhere/ Decorative LED/Ambient light/Night light/Colorful
560954229,"Plus the entire Rondeau range relaunched! Suitable for induction and all heat sources. Non nickel stainless, built to last generations."
1320684559,Bloo is ready to perform some tricks for you! The not so scary clown that has ever walked this planet 🤡
1495069836,Camping gear for Home and Outdoor
1498428822,"Timeless design, combined with premium materials, craftsmanship, and a fun flip-opening. Perfect for everyday tasks."
1767064267,I want to create a social network that allows you to interact with cosplay fans.
1293498449,Print version of GrimReaper Bodyguard Manga and webcomic continues. A fantasy romance story.
854348540,The continuing webcomic Epic Chaos! will have the first 4 chapters accumulated into a graphic novel with tons of Epic goodness.
1061366581,The Lightreaver - epic adventure in the Warcraft Universe
1948768209,"The Weird Guy is an original web comic series about the one oddball you could never put your finger on, but have always wondered about."
1650019785,"I am looking to start printing my already finished work: Paul Ohio
the whole comic is already available to read on my website"
670865131,A Sci-Fi comic in a futuristic setting where innocent lives are used against their will in political warfare.
656335153,A fantasy graphic novel about a group of guys that will reunite one more time the evil source that is threatening their lands again.
885826186,"To put it simply, we're making a comic series!  As with many series, the events that take place are loosely based on real life."
338397503,"300 pages, by pencil and ink, in a fantastic fantasy, Marianka is looking for her love, prisoner of dalgar, an evil witch."
776035243,"THE WARRIORS EDITION collects the last three volumes of the FOR THE TITLE web comic in one big, body-slamming hardcover book!"
639610147,"A collection of over 135 Underfold Comics about parenting, work, puns, D&D and awkward moments--including exclusive comics!"
1146375806,"Introducing the Catana Crossbody, a thoughtfully designed bag made of cactus leather, eliminating unnecessary plastic waste"
439440402,Screen-free | WiFi-free | Tactile | LEGO-like | Learning through play | 4+ | Intuitive | Free from language | Universal design
544894480,"The everything, everywhere bag, everyone needs! Truly modular, 3 in 1 bag made with vegan leather. Goes from everyday to a getaway."
1265883122,A Joint Project That Changes Your Image of Silk Garments With a Hoodie and Pullover That Can Be Worn When Out and About or at Home
1183352968,"Perfect for any home, this sustainable magnetic blackboard is made to fit with any interior aesthetic!"
321624217,"For those that want to eat the juiciest and tastiest chicken ever, this portable and easy to assemble rotisserie has you covered!"
65812216,"Portable Solar + Electric Hybrid Oven cooks a variety of food in under 20 minutes  |  Easy to use, durable, efficient and reliable 😎"
51364584,"Professional & stylish, packable & functional, can be packed into 30% original size, Alan sling bag is the perfect ""one bag for all""."
1899984964,"Heat-resistant, Microwavable, Recyclable & BPA/Toxin/Odor Free. Your safest & most convenient everyday cookware, tableware & drinkware!"
306920296,"Enjoy your own organic, homegrown superfood within days. Just fill with water."
2002803826,Full Titanium Lightweight Unique Design and Quick-Open System Mechanism.Adjustable Bolt for Different Refill Type.Anti-Slip Grip
428489740,"Heat-resistant, antibacterial, food grade container for on the go snacks, parties, dining, picnics, camping, or even board game pieces"
177041437,"Old myths about the devil,  come back. A revolution on  the horizon. And the culture  in decadence."
1189276425,"Fantasy/Action webcomic.
Join Zoe and her squad of unlikely badasses as the fight the forces of the Apocalypse."
1893795501,Ermek the Batyr: Legend of Forgotten Times
435455883,"Production of the original animated manga.
オリジナルのアニメ漫画の制作
I decided to aim for the animated TV series.
テレビアニメ化を目指しています。"
1658602279,"I will be creating a Webcomic/Physical fantasy D&D universe type comic that will have horror, little romance, and lots of adventure!!"
1850072683,"Doblaje de comics xxx de series animadas inglés y español.
Dubbing of comics xxx of animated series with voices in English and Spanish"
1451677014,The print edition of the first volume of The Wild Hunt webcomic
1762951648,Castle Elysium is the Sanctuary for two twin Sisters named Angel and Kairi. They will embark on an adventure that will change the world
2058272369,This campaign is dedicated to reviving the Grawlix Content Management System. Funds will be raised to hire a team of coders and IT.
1967195788,NATKAthology attempts to create a new kind of story telling. Each book series is written in script form along with illustrations.
1432784822,"Four kids are abducted by an alien and are given the powers of earth, water, wind and fire to protect the earth."
656841575,Castle Elysium is the Sanctuary for two twin Sisters named Angel and Kairi. They will embark on an adventure that will change the world
1051197945,78 card tarot deck with meanings conveyed through the complex emotional roles of wrestling characters and angles!⁠
71566081,An all-in-one educational unit with digital platform for children ages 2+ and up
2021258461,Handcrafted sunglasses with a fresh inclusive approach to sizing. You’ll never have to compromise on style or fit again.
1170986182,"The nifty, durable, clever portable storage case for all your vital golf items."
530239356,"👋🏼 Say bye bye to mold, mildew & shower leaks. A shower curtain re-invented to simply be your last."
350619300,A pen engineered to reduce your stress and boost your concentration. A connecting bridge between reality and your next great idea.
308139952,"Discover the purest form of cooking: no coatings, no-nonsense, no compromises on quality.  Made from Titanium, designed with our crowd."
1996951139,We're back with more classes and more big enamel pins!
400560667,"Magnetic bricks, a custom magnetic track, and colorful plates to
set your BRICK TOYS world in motion."
227059005,Cuddly dragons as your new companions with a message of discovering your talents and self-love.
1121628987,"Cute small plushies and patches embroidered in France by myself. 😇
A bear, ghost, bat, manta ray, duckling and a Shrek mystery plush !"
1034104355,Swiss movement watches with ultra-long battery life of up to 10 years & high-quality components. The finest luxury without the markup.
1624968550,A comic about a kindhearted introvert’s struggle with the guilt and anger stemming from her dysfunctional relationship with her family.
195811514,"After Abigail Griffin commits suicide,  she has the chance to fix her mistake by becoming a ""Fate"""
554723160,Working to brand and fund a real pepper nursery  with weekly comic about Monster Pepper Girls.
1330992416,Crystal Story is a webcomic RPG that you experience by reading instead of playing. Help tell the story by funding its first book.
1387530835,"I'm writing a story about an un-princely prince dragon who has to save the universe, with magic. It's about as crazy as it sounds."
396589553,"Modern Age Downfall is an original comic about a Damien, and Isabella, two students who must try to survive a nuclear apocalypse."
1287799025,"Massacre at the Grand Intercontinental duPré! Jack ""The Holiday Hitman"" Frost and his team of killers are murdering their way to space!"
111138226,The story of a Las Vegas boy who becomes a superhero to stop a bat-worshiping street-gang.
2100295639,"Death reaper is a new kind of super hero, his powers are different than the standard super hero. Moreover, he is an exiting superhero"
2110533575,Crystal Story is a webcomic RPG that you experience by reading instead of playing. Help tell the story by funding its first book.
1858127663,Comic inspired and based on both original humor comics and original styles of classic comics in a modern setting & with Old Archetypes!
449966112,"We specialize in comics, novels, stories, seeking to expand to animated and live action films, as well as games."
97199668,"New version of the Gadget endlaces. 
Upgrade your footwear easily, quickly and safely."
863181137,"Comic Box presents it's next dream project, a sky bison soft plush pillow."
469198050,Solid Titanium Watch with Hi Beat Miyota 9015 Movement.  Designed and Assembled in UK.
1618831751,A collection of creepy-cute & witchy enamel pins! FUNDED IN 7 DAYS. Keep pledging & sharing to unlock stretch goals.
187999456,Star themed sweets enamel pins!
177303670,Help me bring to life some more fluffy friends!
1704293345,"Handmade luxury backpacks, briefcases, duffle bags and Padfolios's. Crafted by Artisans, designed in Minneapolis."
419541210,A refreshed version of Ti EDS. Designed for everyday carry (EDC) + Lifetime Warranty + Free Worldwide Shipping!
244108434,Beginners Tarot Deck with Deep Symbolism and A.I. Art
1390986142,Mission to Mars (3d models for 3D printing)
866190749,A project to bring these two pony plush designs to life!
1208548672,"Cute, colourful ita bags + free matching wolf pin with every bag!"
1954403978,Discord's a webcomic about an inter-dimensional library. Volume One will collect the first 160+ pages in one 7x10 paperback.
835570135,I am working on a cartoon project that i want to put on the web. i have many characters and groups designed.
516749618,"I hope to make a new comic company all about the art.
12 weekly books and 6 biweekly books"
2050714855,Help us to print our first book Hero of the Day!
746156607,Mars Oddity is a digital comic with a choose-your-own-adventure feel about the misadventures of two astronauts in a Martian base.
278438464,"Hola mi nombre es David Milagros González, mi idea es hacer un cómic, y que todo mundo pueda disfrutar de el, de la cómic Agencia BBA"
982282766,"Dragon Ball Z fan Manga: to fans by fans! Let's make alive our dream - best Manga in the world with your help, guys!"
1577632645,A revival of Life As He Knew It: Chapter 1
2124398070,Spirits are becoming a common sighting in Lantern Peak. These paranormal events will change the daily life of a young boy named Alex.
1367480812,The rock music of The Killers is of the most critically acclaimed of the decade; and we're honoring it through a new webcomic story!
1133647084,A print collection of the webcomic Uh-Oh Dad!
756672873,"Straight from the Bookkeeper's Library comes a story of adventure, drama, mystery with a hint of comedy."
2051970763,"Handmade in England with quality materials and craftsmanship, designed to last a lifetime. Only 50 available!"
1986598004,"Stainless steel, pocket size, isometric grid, compass, ruler, protractor, and more with iconic HELVETICA typeface."
2002160593,A squishy axolotl plush with a waffle theme!
31452510,Travel to places once out of reach and experience nature in its most serene setting.
1730215040,"Genius Loci is a simple, seamless way to promote thousands of places that are still secret."
585339402,From work to travel the Viceroy will keep you organized and fashionable throughout your journeys.
1738554366,First watch with Sapphire Crystal Crown inspired by Celtic Era.
1604295561,"Pop-to-Light. Magnetic Base. Rechargeable. Tiny but Super Bright. Extremely Convenient, Easy, Fast to Use Than Ever Before."
970121619,The Best Way of Having an Instantly Cozy Hot Tent for Your Outdoor Adventures.
765718293,3d models for 3d printing in STL format
885552925,"Discover amazing 1300 year old traditional Japanese jointery in beautiful puzzle form, that utilizes brilliant Japan-produced wood!"
1376607290,Collection de pin's inspirée par l'univers de Disney et ses princesses et héroïnes.
1482531681,"Manga/Comic 
Illustrations & Writing
your dollar can have an affect on:
Characters
Scenaries 

And more, so choose wisely.
."
1400222758,"A poppy comedy about unhealthy bromances, the fighting spirit, and a chick who can't seem to leave her reckless martial arts teammates."
1795433372,"50+ new pages of ""Warrior Cats: Twin Shadows"" over the course of August."
436187534,"A urban manga to anime, based on Certain  Events that happened where a world Now has an opportunity to attain Spiritual power."
1315394605,Art has always been my passion and i have always enjoyed it. I would love to be able to animate to entertain viewers.
1986196714,Where monsters can be as much like people as people like monsters.
1456188848,"New Shonen webcomic with 40+ full color pages able online now, and hoping to continue with the making of the 2nd volume with your help."
1922160285,Twisted Fate is an original comic strip I created about incapable new Fates with some funny adventures.
15712097,"The adorable main character of the webcomic, Evon, could be yours in chibi form!"
1132765515,Final volume of the reader-fueled webcomic about bad jobs. 50 strips + guest comics!
1789646965,Dungheap Volume Two is a comic that continues the fantasy adventures of a kid from two races on the run from ancient creatures.
1302941454,"The first chapter of the Redbark Cove webcomic, The Abalone Necklace, is done and we're trying to get it into print format."
1784099677,The new motorcycle luggage collection from Wentworth Moto! Premium materials & built to last. Includes the new Shakedown Tool Roll.
195519491,Distinctive timepieces  with a choice of automatic or meca-quartz chronograph movements
882236370,"Draw comfortably on the couch, in bed, and on the go."
1313535137,"An exclusive, affordable automatic watch that contains steel taken from a satellite ground station at the South Pole."
1462915980,MuttRuk design and durability come together for a superbly functional and stylish treat pouch.
537625395,Not your average collapsible bags!  A collection of collapsible bags so well designed you'll want to use them as everyday bags!
1246079533,"Four heavy steel pieces interlock to create a modern masterpiece of mechanical puzzles. Elegant, challenging, and deeply satisfying."
2124765593,A clever addition to your workplace
1708731743,"Jumble-Free jetting is here. Keep all those dongles, cables, adapters, toothbrush, lotions etc. under control."
504537594,Uniquely shaped litter box | Blends into any home | Integrated scoop (works with all litter types) | Charcoal filter | Optional Mat
292030859,"A quantum leap in binding steel & iron wires has made Effortless, Safe, and Easy the task of producing strong wire knots without hassle"
237072414,Jurassic Mist: the room spray that smells like the Jurassic forest
1998462306,Bad Pudding is a gag webcomic available for free. This campaign is to support its continuation to the end of 2017.
1274654071,A comic of a young man who discovers a powerful badge that can transform him into a werewolf
1732476904,"Jaro quiere pasarse al papel ¡y sólo con tu ayuda lo conseguiremos! 
Una aventura repleta de misterio, acción y humor."
694779665,A Free Online Graphic Novel / Webcomic. You will never have to pay to read or follow Daughters of Divinity
978449413,Origin of the Wolves is a graphic novel about a young mans survival and the creation of a new people.
1190156979,This project will fund the publication of the next six months of the comic strip Experiment 42.
1907485611,Tired of waiting? Let Bunny help you. She is wonderful at coming up with things to do while you wait! Perfect for all ages.
724615246,Arcade style battle web-comic Un-boy needs your help!
1348612950,"The voices in your head punch, bite and claw their way into your heart. Buckle up for misadventure!"
1866080905,I am making a FNAF comic with the help of a fellow artist in DeviantArt by the name of akuoreo. Want to see something's weird?
483086509,I am into creating independent science fiction web comics
1431054828,Publication de notre BD en ligne: Harcèlement.
82163060,"Reusable Environment Earth Durable | Multi function Container | Microwave, Dishwasher & Freezer Safe | Home, Child & Family"
1406731087,The Mess-free Solution For a Spotless Fish Tank | 2-in-1 Automatic and Hand-held| Quiet To Operate| Sand and Gravel Substrate Friendly
1443024813,"Extreme diver watch Swiss automatic, sapphire glass, automatic helium valve, ceramic bezel, solid bracelet and included stretch goal."
1776133498,Keep your liquids always safe in the container | Carry your drinks without ever spilling out | Based on Physics | In 3 Colors
206208333,"When $h!t happens, the Poopsy Daisy will hold your used poop bags."
765086765,A ferrofluid speaker that let you enjoy music with your eyes as much as your ears
1721338193,A cushion can solve your troubles of being exposed to the sun in summer!
733124399,Plant-based powder to sustainable body care - making your plastic waste disappear.
1836605491,"Lightweight, convenient, and portable, ZZIM NANG is your very own far infrared dry sauna!"
1467834837,"One publication, two covers, many worlds for the mind readers, by 2022 graphic design students from RMIT Brunswick."
666478775,Have you heard of the elusive “cantina coin”? I’m trying to raise funds to put a SIXTH version into production!
1874977538,"VIXA embodies superior precision, artistry and technology. A tribute to Leonardo Da Vinci, the almighty genius in human history."
2082206288,"Dollhouse is an on-going comic set in St. Louis. Haunted Gospels is the second volume of the comic, chapters 5-8! Let's print this!"
1376614324,The equilibrium of the town of Hornsville is thrown into disarray after their local superhero dies and another takes his place...
124745490,"Vagabond answers the age old question ""What do we do with the homeless?"" We send them to another planet, of course!"
1468839061,This is a continuous strip about the Baby Boomers. It's loosely based on characters you knew as children. Goal: 6 new strips per month.
891621150,"Meeting your idol is sometimes a bit of a disappointment, especially when he is a narrow-minded douche with a huge ego."
1948318332,"An original webcomic series, available to read on Tapastic!"
1257027972,"We want to make a book full of YOUR memes.
There are so much good memes out there, why shouldn't there be a book?"
1414517672,"I plan to create an addition to the Gurral the Smasher kaiju webcomics found at gurralcomic.com.  More plot, and greater webcomic feel."
236970136,"In a supernatural apocalyptic future, nothing is what it seems. Follow the stars to where the light ends and darkness begins."
1656535021,I'm creating a weekly comic titled To Be Continuous which is a memoir. I use continuous line drawing to show the continuity of life.
69942982,"""Ask a Cat"" is a webcomic that features Cat answering people's questions. This project is to publish the first book collection."
1213877201,"In this adrenaline pumping, action-adventure/superhero comedy, Mopy joins forces with a zany superhero to stop an ancient evil."
803503147,3d models for 3d printing in stl format for your favorite board games
319634702,Come and spend a magical and warm moment in the Shire with this Box filled with surprise creations !
93760723,"Rockets, Robots & Ray Guns - need I say more?"
1136083639,"A set of four vintage retro styled cocktail prints including margarita, aperol spritz, mojito and a classic espresso martini."
1570263299,"Enjoy tea with simplicity, and the temperature can be seen and controlled freely."
378309789,Collection of 3D models of premium detail ships!  (3d models for 3d printing)
1605970157,A full color book by RMIT University Graphic Design students.
348195790,A collection of 6 rainbow frog enamel pins!
725230294,Adorable soft cuddly plushies of the main Dragons Blood trio!
573775297,Discover Gold - Made in Solingen Exclusive Tableware I Gold Plated I Handmade in Germany I Edel Besteck Set I Cutlery with design I
1032665427,A traditional blanket combined with strategically located slits and flaps to allow your arms and legs to move freely | Patent pending
625289269,Collection of 3d models for 3d printing for your board game.
1094516637,"We are creating a comic book about an original script we made. In order to fund the show and gain fans, we want to make a comic series."
